{
  "name": "numbered-outfit-looks",
  "niche": "маркетплейс-подборки",
  "status": "proposed",
  "hook_structure": {
    "timing": "0-2 сек",
    "elements": [
      "Текстовое обещание подборки готовых образов под сезон или повод — верифицированные капшены winners: «Летняя мужская подборка 🔥», «Лучшая мужская летняя подборка», «Большая мужская подборка 🔥» (igorvelvet7), «Подборка летних образов ☀️» (serzhjikk), «Летние костюмы» (daddy.kalmykov.fa), «Сделал для вас подборку образов с вб» (annton.kostill)",
      "Первый образ показан сразу — без интро и подводки, за 2 секунды зритель считывает формат «образ за образом»",
      "Допустим вопрос-вовлечение вместо заголовка: «В каком из образов пошли бы на встречу, а в каком — просто гулять по городу?» (noface_style). Приём дополняет показ образов, а не заменяет его: у того же автора «Образ какой страны выберешь ты?» без показа комплектов проваливается"
    ]
  },
  "problem_definition": "Зритель не умеет собирать вещи с маркетплейса в цельный образ: отдельные находки не решают задачу «что надеть», а поиск сочетаний вручную требует времени и вкуса.",
  "solution_structure": {
    "steps": [
      "1. Хук: заголовок подборки + первый образ (0-2 сек)",
      "2. Образы по очереди: каждый — полный комплект (верх+низ, при необходимости обувь/аксессуар), показанный на человеке или аккуратной раскладкой",
      "3. Смена образа каждые 1.5-3 сек, без озвучки, под трендовый звук",
      "4. Артикулы WB доступны зрителю: либо пронумерованным списком в капшене («1 ОБРАЗ Рубашка в полоску — #622622458, Шорты коричневые — #617699735»), либо в закрепе/тг-канале — на ER это не влияет"
    ],
    "items_count": "5-12 образов (меньше пяти — формат не читается)",
    "duration_sec": "12-18"
  },
  "visual_requirements": [
    "Каждый образ — законченный комплект, а не одиночная вещь",
    "Показ на человеке или аккуратной раскладкой, крупно",
    "Смена кадра на каждом образе",
    "Порядок образов читается визуально (номер на экране или явная последовательность)"
  ],
  "cta_type": "«Сохраняй артикулы» или вопрос-вовлечение в капшене; артикулы — списком в капшене или ссылкой в закрепе/тг, оба варианта равнозначны по ER",
  "prohibitions": [
    "Одиночная категория вещей (парад футболок, джинсов, поло) вместо собранных образов: каждый показ — полный комплект верх + низ, при необходимости обувь/аксессуар",
    "Generic SEO-капшен из одних хэштегов, без списка образов с артикулами или вопроса-вовлечения",
    "Озвученный styling-разбор двух-трёх образов в этом формате — это жанр voiced-expert-review, а не парада",
    "Музыкальный липсинк вместо показа вещей"
  ],
  "evidence": {
    "source_urls": [
      "https://www.tiktok.com/@serzhjikk/video/7625306460284620053",
      "https://www.tiktok.com/@daddy.kalmykov.fa/video/7641620743783976210",
      "https://www.tiktok.com/@serzhjikk/video/7630861617470721300",
      "https://www.tiktok.com/@igorvelvet7/video/7644211822605749524",
      "https://www.tiktok.com/@igorvelvet7/video/7668701933649136917",
      "https://www.tiktok.com/@igorvelvet7/video/7659437911745629461",
      "https://www.tiktok.com/@igorvelvet7/video/7655352647590907157",
      "https://www.tiktok.com/@alex_fitrend/video/7643137303396764931",
      "https://www.tiktok.com/@igorvelvet7/video/7654979797432536340",
      "https://www.tiktok.com/@igorvelvet7/video/7658613606501764372",
      "https://www.tiktok.com/@noface_style/video/7661285337418697991",
      "https://www.tiktok.com/@annton.kostill/video/7657608441401298193"
    ],
    "avg_views": 1095700.0,
    "avg_er": 0.06718
  },
  "confidence": "high",
  "conditions": "TikTok, ниша маркетплейс-подборки, RU-маркетплейсы (WB), ролики 12-18 сек БЕЗ озвучки, 5+ готовых образов-комплектов подряд. Артикулы — в капшене или в закрепе/тг (равнозначно). Для одиночных категорий вещей и озвученных обзоров не применять (см. voiced-expert-review).",
  "source_pattern_ids": [
    "marketpleys-podborki-tt-numbered-outfits-01"
  ],
  "version": 3,
  "updated_at": "2026-08-11",
  "status_reason": ""
}
