{
  "name": "expert-item-breakdown",
  "niche": "бренды-магазины",
  "status": "approved",
  "hook_structure": {
    "timing": "0-3 сек",
    "elements": [
      "Вопрос или возражение зрителя: «Is this the perfect summer shirt?», «в пиджаке летом жарко — правда?»",
      "Или проблема сегмента аудитории: «Finding clothes that fit short kings so you don't have to»"
    ]
  },
  "problem_definition": "Зритель сомневается в конкретной вещи или типе вещи (жарко/не сядет/переплата) и не умеет отличить качественную вещь от посредственной; общие рекламные слова ему не помогают.",
  "solution_structure": {
    "format": "Экспертный разбор одной вещи или одного образа от лица знающего человека",
    "specifics": "Только проверяемая конкретика: состав и плотность ткани («смесь шерсти, льна и шёлка, 320 г/м»), конструкция («без подкладки», «скрытые пуговицы, асимметричная застёжка»), советы по посадке и размеру («size down two sizes»), точная цена образа",
    "answer_objection": "Разбор строится как ответ на вопрос/возражение из хука, а не как перечень характеристик",
    "duration_sec": "12-120: короткий разбор одной вещи или развёрнутый ответ-возражение"
  },
  "visual_requirements": [
    "Вещь в руках или на человеке крупным планом в момент называния детали (ткань, застёжка, посадка)",
    "Эксперт в кадре (владелец магазина, стилист, автор) — подача от первого лица",
    "Демонстрация свойств вживую: просвет ткани, заломы, посадка при движении"
  ],
  "cta_type": "Мягкий: сайт/магазин в конце после доказанной ценности, или вопрос аудитории; продажа не раньше, чем дан ответ по существу",
  "prohibitions": [
    "Не начинать с саморекламы («у нас акция», «базовая футболка — основа гардероба») — так открываются losers ниши",
    "Конкретика без экспертной подачи не работает: перечень характеристик в лобовой рекламе магазина — паттерн losers (alash_jeans, 1.6k просмотров)",
    "Не публиковать показ товара под музыку без речи",
    "Адрес/телефон/рассрочка не должны быть главным содержанием ролика или капшена"
  ],
  "evidence": {
    "source_urls": [
      "https://www.tiktok.com/@neojussi/video/7655714138433342753",
      "https://www.tiktok.com/@cerca_trova_official/video/7637534937452662038",
      "https://www.tiktok.com/@rhodes_wood/video/7662335917952126230",
      "https://www.tiktok.com/@ivofits/video/7662442325129465090"
    ],
    "avg_views": 65531.5,
    "avg_er": 0.08969
  },
  "confidence": "medium",
  "conditions": "Ниша бренды-магазины; разбор одной вещи/образа от лица эксперта (в т.ч. собственного бренда или магазина — в отличие от brand-list-quick-positioning, здесь допустима своя вещь, если ролик отвечает на вопрос зрителя, а не рекламирует точку продаж); 12-120 сек.",
  "source_pattern_ids": [
    "bm-expert-fabric-specifics",
    "bm-problem-intrigue-hook"
  ],
  "version": 1,
  "updated_at": "2026-07-15",
  "status_reason": ""
}