{
  "name": "contrarian-verdict",
  "niche": "мужской-стиль",
  "status": "proposed",
  "hook_structure": {
    "timing": "0-3 сек",
    "elements": [
      "Категорический запрет, направленный на вещь или привычку: «мужчины, давайте договоримся раз и навсегда — мы не носим брюки такого силуэта», «никогда не надевай slim fit костюм», «хватит носить один и тот же аутфит на каждое свидание»",
      "Либо развенчание: «большинство современных bootcut — это просто узкие джинсы с клёшем внизу»",
      "Вердикт от первого лица, тоном уверенного эксперта, без дисклеймеров",
      "Предмет спора сразу в кадре: «неправильная» вещь показана визуально",
      "Короткий вариант для Instagram: запрет и правило-замена одной фразой в первые 3 сек — «носки должны продолжать цвет брюк, а не обуви»"
    ]
  },
  "problem_definition": "Зритель носит популярную вещь или следует привычке, которая портит его образ, и не подозревает об этом: она выглядит нормой и встречается везде. Ему нужен не совет «подбери по фигуре», а прямое указание, что именно перестать делать и чем это заменить.",
  "solution_structure": {
    "steps": [
      "1. Вердикт-запрет против конкретной вещи, кроя или привычки (0-3 сек)",
      "2. Короткий аргумент, почему это не работает: силуэт, посадка, пропорции, контекст (3-15 сек)",
      "3. Спецификация замены с деталями — крой, посадка, материал, модель («объёмные защипы, длина в пол, посадка чуть ниже пупка», «loose или relaxed bootcut», «260 GSM») либо разбивка замены по контекстам (типы свиданий: ужин, кофе, коктейль-бар)",
      "4. Вопрос аудитории для вовлечения (финал)"
    ],
    "duration_sec": "8-100",
    "instagram_short_variant": "15-60 сек: один предмет гардероба за ролик, вердикт + правило-замена + одно «почему» (силуэт, посадка, качество); без развёрнутой разбивки по контекстам"
  },
  "visual_requirements": [
    "Контраст «плохого» и «хорошего» варианта на реальном человеке",
    "Автор в кадре или примеры вещей на мужчинах",
    "Монтаж в ритме озвучки, смена кадра на каждом аргументе"
  ],
  "cta_type": "вопрос-мнение («что думаете?», «какой вариант лучше?»)",
  "prohibitions": [
    "Запрет, направленный на зрителя, а не на вещь: «колхоз», «не выглядеть как колхозник», «джентльмен так не носит», «мне плевать, как я выгляжу»",
    "Запрет по возрасту или фигуре зрителя: «мужчинам за 40 нельзя шорты»",
    "Вердикт без спецификации замены: назвал вещь плохой и не сказал, что носить вместо",
    "Шаблонный повтор оценок без аргумента: «это стильно — а это колхоз» по кругу",
    "Лекционный тон стилиста без личной позиции автора",
    "Прямая продажа в кадре или капшене: «ссылка в профиле», «успей купить», артикул, промокод, адрес магазина",
    "Комментарий-бейт: «напиши слово в комментариях — пришлю подборку»"
  ],
  "evidence": {
    "source_urls": [
      "https://www.tiktok.com/@clotheshunter/video/7570624152009313554",
      "https://www.tiktok.com/@boyfriend.mov/video/7656876595499502870",
      "https://www.tiktok.com/@hugomacwood/video/7659837387664657685",
      "https://www.tiktok.com/@joepum/video/7656903670927248643",
      "https://www.tiktok.com/@diutoajoku/video/7670667850050489621",
      "https://www.instagram.com/p/Da09mHQxszI/",
      "https://www.instagram.com/p/DavBb2CTHLd/",
      "https://www.instagram.com/p/CoY4cb6ID3z/"
    ],
    "avg_views": 670124.75,
    "avg_er": 0.11863
  },
  "confidence": "high",
  "conditions": "TikTok и Instagram Reels, ниша мужской-стиль. TikTok: 8-100 сек, допустима разбивка замены по контекстам. Instagram: 15-60 сек, один предмет гардероба за ролик, правило-замена с одним «почему». Объект запрета — предмет гардероба, крой или привычка ношения, не зритель и не его социальный статус. Спецификация замены обязательна: запрет без замены уходит в нижний квартиль. Взаимоисключающа с color-upgrade-ladder — в одном ролике либо запрет, либо надстройка без осуждения. Охваты evidence разнородны (22K—3.9M, две платформы): медианные ожидания охвата не по мем-ролику.",
  "source_pattern_ids": [
    "muzhskoy-stil-tt-contrarian-verdict-01",
    "muzhskoy-stil-tt-contrarian-verdict-02",
    "muzhskoy-stil-tt-contrarian-verdict-03",
    "muzhskoy-stil-tt-contrarian-verdict-04",
    "muzhskoy-stil-ig-contrarian-verdict-01"
  ],
  "version": 4,
  "updated_at": "2026-08-13",
  "status_reason": "Требует решения оператора: два из трёх Instagram-примеров используют статусную рамку («джентльмен не носит», «не выглядеть чапри»), а один — комментарий-бейт, то есть механики из prohibitions формулы; v4 расширяет формулу на Instagram, НЕ ослабляя запреты — если статусную рамку на Instagram допускать, это отдельное решение (паттерн ig-contrarian-verdict-01 помечен human_review). Первый Instagram-батч ниши: приём подтверждён тремя winners в коротком формате. Утверждённый снапшот v3 работает, пока v4 не одобрена."
}