{
  "name": "numbered-outfit-looks",
  "niche": "маркетплейс-подборки",
  "status": "approved",
  "hook_structure": {
    "timing": "0-2 сек",
    "elements": [
      "Текстовое обещание подборки готовых образов под сезон или повод — верифицированные капшены winners: «Летняя мужская подборка 🔥», «Лучшая мужская летняя подборка» (igorvelvet7), «Подборка летних образов ☀️» (serzhjikk), «Летние костюмы» (daddy.kalmykov.fa), «Образы под поло🔥» (alex_fitrend)",
      "Первый образ показан сразу — без интро и подводки, за 2 секунды зритель считывает формат «образ за образом»",
      "Допустим вопрос-вовлечение вместо заголовка: «В каком из образов пошли бы на встречу, а в каком — просто гулять по городу?» (noface_style, ER 0.0578). Приём дополняет показ образов, а не заменяет его: у того же автора «Образ какой страны выберешь ты?» дал ER 0.0245 при 7K просмотров"
    ]
  },
  "problem_definition": "Зритель не умеет собирать вещи с маркетплейса в цельный образ: отдельные находки не решают задачу «что надеть», а поиск сочетаний вручную требует времени и вкуса.",
  "solution_structure": {
    "steps": [
      "1. Хук: заголовок подборки + первый образ (0-2 сек)",
      "2. Образы по очереди: каждый — полный комплект (верх+низ, при необходимости обувь/аксессуар), показанный на человеке или аккуратной раскладкой",
      "3. Смена образа каждые 1.5-3 сек, без озвучки, под трендовый звук",
      "4. Артикулы WB доступны зрителю: либо пронумерованным списком в капшене («1 ОБРАЗ Рубашка в полоску — #622622458, Шорты коричневые — #617699735»), либо в закрепе/тг-канале — на ER это не влияет"
    ],
    "items_count": "5-12 образов (меньше пяти — формат не читается)",
    "duration_sec": "12-18"
  },
  "visual_requirements": [
    "Каждый образ — законченный комплект, а не одиночная вещь",
    "Показ на человеке или аккуратной раскладкой, крупно",
    "Смена кадра на каждом образе",
    "Порядок образов читается визуально (номер на экране или явная последовательность)"
  ],
  "cta_type": "«Сохраняй артикулы» или вопрос-вовлечение в капшене; артикулы — списком в капшене или ссылкой в закрепе/тг, оба варианта равнозначны по ER",
  "prohibitions": [
    "Одиночная категория вещей вместо собранных образов — same-account пары: igorvelvet7 «4 базовые футболки» ER 0.0201 при 5.8K против его же образов ER 0.059-0.080 при 146K-820K; alex_fitrend «Футболки на лето» ER 0.0244 при 2.3K против «Образы под поло» ER 0.0577 при 247K. Это эвристика, а не закон: serzhjikk с парадом из шести поло и рубашек взял 2.5M и ER 0.0587 — но там сильный хук-вовлечение «Девушки, я прав?»",
    "Generic SEO-капшен из хэштегов без содержания (wb.kiko2 ER 0.013-0.019 при 1.4K-43K, wbglamour 0.0133, wb.man.out 0.0107, hustleswag52 0.0093, lookcheck_wb 0.0239, streetcreedwb 0.0241)",
    "Два-три образа с озвученным styling-разбором в этом формате — другой жанр и другой результат: mambetich, 50 сек, два образа, ER 0.0199 при 309K",
    "Музыкальный липсинк вместо показа вещей (wb.stop ER 0.0123 при 399K просмотров)"
  ],
  "evidence": {
    "source_urls": [
      "https://www.tiktok.com/@igorvelvet7/video/7654979797432536340",
      "https://www.tiktok.com/@alex_fitrend/video/7643137303396764931",
      "https://www.tiktok.com/@noface_style/video/7661285337418697991",
      "https://www.tiktok.com/@igorvelvet7/video/7644211822605749524",
      "https://www.tiktok.com/@daddy.kalmykov.fa/video/7641620743783976210",
      "https://www.tiktok.com/@igorvelvet7/video/7655352647590907157",
      "https://www.tiktok.com/@igorvelvet7/video/7658613606501764372",
      "https://www.tiktok.com/@igorvelvet7/video/7659437911745629461",
      "https://www.tiktok.com/@serzhjikk/video/7630861617470721300",
      "https://www.tiktok.com/@serzhjikk/video/7625306460284620053"
    ],
    "avg_views": 1232030.0,
    "avg_er": 0.06769
  },
  "confidence": "high",
  "conditions": "TikTok, ниша маркетплейс-подборки, RU-маркетплейсы (WB), ролики 12-18 сек БЕЗ озвучки, 5+ готовых образов-комплектов подряд. Артикулы — в капшене или в закрепе/тг (равнозначно). Для одиночных категорий вещей и озвученных обзоров не применять (см. voiced-expert-review).",
  "source_pattern_ids": [
    "marketpleys-podborki-tt-numbered-outfits-01"
  ],
  "version": 2,
  "updated_at": "2026-07-26",
  "status_reason": ""
}